<?xml version="1.0" encoding="UTF-8"?>
<!DOCTYPE recipe_system SYSTEM "recipe.dtd">
<recipe_system>
    <users>
        <user>
            <name>Laura</name>
            <surname>Eraso</surname>
            <skill_level>Intermediate</skill_level>
            <preferred_cuisine>Spanish</preferred_cuisine>
        </user>
    </users>
    <recipes>
        <recipe>
            <title>Paella</title>
            <cuisine_type1>Spanish</cuisine_type1>
            <cuisine_type2>European</cuisine_type2>
            <difficulty>Intermediate</difficulty>
        </recipe>
        </recipes>
</recipe_system>